{
  "kind": "json_schemas_manifest",
  "title": "Contact360 JSON Schema registry",
  "version": "1.0.0",
  "status": "stable",
  "schema_refs": [],
  "sections": [],
  "schemas": [
    {
      "id": "Activity",
      "path": "Activity.json",
      "title": "Activity",
      "version": "1.0.0",
      "tags": [
        "entity"
      ]
    },
    {
      "id": "ai.query.completed.v1",
      "path": "ai.query.completed.v1.json",
      "title": "ai.query.completed.v1",
      "version": "1.0.0",
      "tags": [
        "event",
        "kafka"
      ]
    },
    {
      "id": "ApiError",
      "path": "ApiError.json",
      "title": "ApiError",
      "version": "1.0.0",
      "tags": [
        "api"
      ]
    },
    {
      "id": "ApiKey",
      "path": "ApiKey.json",
      "title": "ApiKey",
      "version": "1.0.0",
      "tags": [
        "entity"
      ]
    },
    {
      "id": "AsyncJobResponse",
      "path": "AsyncJobResponse.json",
      "title": "AsyncJobResponse",
      "version": "1.0.0",
      "tags": [
        "api"
      ]
    },
    {
      "id": "BillingLedgerEntry",
      "path": "BillingLedgerEntry.json",
      "title": "BillingLedgerEntry",
      "version": "1.0.0",
      "tags": [
        "entity"
      ]
    },
    {
      "id": "campaign.completed.v1",
      "path": "campaign.completed.v1.json",
      "title": "campaign.completed.v1",
      "version": "1.0.0",
      "tags": [
        "event",
        "kafka"
      ]
    },
    {
      "id": "Campaign",
      "path": "Campaign.json",
      "title": "Campaign",
      "version": "1.0.0",
      "tags": [
        "entity"
      ]
    },
    {
      "id": "campaign.sent.v1",
      "path": "campaign.sent.v1.json",
      "title": "campaign.sent.v1",
      "version": "1.0.0",
      "tags": [
        "event",
        "kafka"
      ]
    },
    {
      "id": "Company",
      "path": "Company.json",
      "title": "Company",
      "version": "1.0.0",
      "tags": [
        "entity"
      ]
    },
    {
      "id": "contact.created.v1",
      "path": "contact.created.v1.json",
      "title": "contact.created.v1",
      "version": "1.0.0",
      "tags": [
        "event",
        "kafka"
      ]
    },
    {
      "id": "Contact",
      "path": "Contact.json",
      "title": "Contact",
      "version": "1.0.0",
      "tags": [
        "entity"
      ]
    },
    {
      "id": "contact.updated.v1",
      "path": "contact.updated.v1.json",
      "title": "contact.updated.v1",
      "version": "1.0.0",
      "tags": [
        "event",
        "kafka"
      ]
    },
    {
      "id": "Deal",
      "path": "Deal.json",
      "title": "Deal",
      "version": "1.0.0",
      "tags": [
        "entity"
      ]
    },
    {
      "id": "email.bounced.v1",
      "path": "email.bounced.v1.json",
      "title": "email.bounced.v1",
      "version": "1.0.0",
      "tags": [
        "event",
        "kafka"
      ]
    },
    {
      "id": "email.clicked.v1",
      "path": "email.clicked.v1.json",
      "title": "email.clicked.v1",
      "version": "1.0.0",
      "tags": [
        "event",
        "kafka"
      ]
    },
    {
      "id": "email.opened.v1",
      "path": "email.opened.v1.json",
      "title": "email.opened.v1",
      "version": "1.0.0",
      "tags": [
        "event",
        "kafka"
      ]
    },
    {
      "id": "enrichment.job.completed.v1",
      "path": "enrichment.job.completed.v1.json",
      "title": "enrichment.job.completed.v1",
      "version": "1.0.0",
      "tags": [
        "event",
        "kafka"
      ]
    },
    {
      "id": "EnrichmentJob",
      "path": "EnrichmentJob.json",
      "title": "EnrichmentJob",
      "version": "1.0.0",
      "tags": [
        "entity"
      ]
    },
    {
      "id": "lead.scored.v1",
      "path": "lead.scored.v1.json",
      "title": "lead.scored.v1",
      "version": "1.0.0",
      "tags": [
        "event",
        "kafka"
      ]
    },
    {
      "id": "Money",
      "path": "Money.json",
      "title": "Money",
      "version": "1.0.0",
      "tags": [
        "shared"
      ]
    },
    {
      "id": "Organization",
      "path": "Organization.json",
      "title": "Organization",
      "version": "1.0.0",
      "tags": [
        "entity"
      ]
    },
    {
      "id": "OrgContext",
      "path": "OrgContext.json",
      "title": "OrgContext",
      "version": "1.0.0",
      "tags": [
        "shared"
      ]
    },
    {
      "id": "PaginatedList",
      "path": "PaginatedList.json",
      "title": "PaginatedList",
      "version": "1.0.0",
      "tags": [
        "api"
      ]
    },
    {
      "id": "SequenceStep",
      "path": "SequenceStep.json",
      "title": "SequenceStep",
      "version": "1.0.0",
      "tags": [
        "entity"
      ]
    },
    {
      "id": "Template",
      "path": "Template.json",
      "title": "Template",
      "version": "1.0.0",
      "tags": [
        "entity"
      ]
    },
    {
      "id": "User",
      "path": "User.json",
      "title": "User",
      "version": "1.0.0",
      "tags": [
        "entity"
      ]
    },
    {
      "id": "WebhookDelivery",
      "path": "WebhookDelivery.json",
      "title": "WebhookDelivery",
      "version": "1.0.0",
      "tags": [
        "api"
      ]
    },
    {
      "id": "_meta-schema.event",
      "path": "_meta-schema.event.json",
      "title": "_meta-schema.event",
      "version": "1.0.0",
      "tags": [
        "meta"
      ]
    },
    {
      "id": "_meta-schema.index",
      "path": "_meta-schema.index.json",
      "title": "_meta-schema.index",
      "version": "1.0.0",
      "tags": [
        "meta"
      ]
    }
  ]
}
